<?xml version="1.0" encoding="UTF-8"?>

<!ELEMENT students (student+)>
<!ELEMENT student (id, name)>
<!ELEMENT id (#PCDATA)>
<!ELEMENT name (#PCDATA)>